{
  "id": "material_deer_hide",
  "type": "material",
  "name": "Deer hide",
  "classes": [
    "hide"
  ],
  "won_from": [
    "fauna_painted_deer"
  ],
  "found_in": [
    "forest",
    "plains"
  ],
  "rarity": "common",
  "renews": "seasonal",
  "notes": "The painted deer already gave canon its antler and its sinew, and an animal that gives both gives its skin. Lighter than goat hide and the delta's ordinary leather, which is why a bedroll on Lothal is backed with it.",
  "canon": "inferred",
  "sources": [
    "owner, 2026-10-01 (Roads and Hands, phase 1)"
  ],
  "source_index": 77
}
