{
  "id": "material_windfall_wood",
  "type": "material",
  "name": "Windfall wood",
  "classes": [
    "timber",
    "fuel"
  ],
  "won_from": [
    "flora_aero_mangrove_vayu_vriksha",
    "flora_bonewood_mangrove",
    "flora_crimson_leaved_ash_banyan",
    "flora_date_palm",
    "flora_ghost_mangrove",
    "flora_giant_mangrove_palm",
    "flora_haritaki",
    "flora_highland_bitter_mahua",
    "flora_iron_root_mangrove",
    "flora_iron_teak",
    "flora_ivory_coastal_bonewood",
    "flora_jackfruit",
    "flora_mahua",
    "flora_mango",
    "flora_mappa_mundi_banyan",
    "flora_neem",
    "flora_nux_vomica",
    "flora_oasis_date_palm",
    "flora_palmyra_palm",
    "flora_plunging_fire_siege_tree",
    "flora_root_anchored_artillery_tree",
    "flora_sandalwood",
    "flora_silver_leaved_oracle_fig",
    "flora_spiny_acacia",
    "flora_sweet_nectar_mahua",
    "flora_tamarind",
    "flora_vindhya_pine",
    "flora_weeping_charcoal_tree",
    "flora_whisper_fig"
  ],
  "found_in": [
    "forest",
    "coast",
    "hills",
    "mountains",
    "plains",
    "river",
    "wetland",
    "settlement",
    "desert",
    "sky_island"
  ],
  "rarity": "common",
  "renews": "fast",
  "notes": "Whatever a tree lets fall: limbs brought down by the monsoon, a trunk the river undercut, the dead lower branches anyone may take. Every tree gives it and none is felled for it, which is why it comes back as fast as weather does. Straight enough for a pole and dry enough for a fire -- the stuff a traveller actually builds and cooks with, where teak and sandalwood are what a city builds with. Added on the owner's ruling of 2 October 2026 that the trunks a traveller walks past should be good for something.",
  "canon": "inferred",
  "sources": [
    "docs/decisions.md"
  ],
  "source_index": 78
}
