{
  "id": "material_palm_husk",
  "type": "material",
  "name": "Palm husk",
  "classes": [
    "fibre"
  ],
  "won_from": [
    "flora_date_palm",
    "flora_oasis_date_palm",
    "flora_palmyra_palm"
  ],
  "found_in": [
    "desert",
    "settlement",
    "plains"
  ],
  "rarity": "common",
  "renews": "fast",
  "notes": "The coarse mat of fibre at the base of a frond. Harsher than reed and far more patient of salt water, which is why the harbour rope is husk and the house rope is reed. The date palms give it in the desert and the palmyra on the dry plains, which is where Dwarka's and the Narmada's comes from.",
  "canon": "inferred",
  "sources": [
    "docs/bestiary.md"
  ],
  "source_index": 1
}
