{
  "id": "material_datura_seed",
  "type": "material",
  "name": "Dhatura seed",
  "classes": [
    "poison"
  ],
  "won_from": [
    "flora_datura"
  ],
  "found_in": [
    "plains",
    "settlement"
  ],
  "rarity": "common",
  "notes": "Kept for the shrine and never for the pot. Canon records no preparation that makes these safe, and the households that grow it do not look for one.",
  "canon": "secondary",
  "sources": [
    "Indian ethnobotany, adapted to canon"
  ],
  "source_index": 54
}
