{
  "id": "material_lamp_black",
  "type": "material",
  "name": "Lamp black",
  "classes": [
    "pigment"
  ],
  "rarity": "common",
  "notes": "Soot caught on a cold plate held over a flame. Bound with gum it is ink, which makes it the material Varuna's diary is actually written in. Soot caught on a plate. Nobody gathers it; somebody makes it.",
  "canon": "inferred",
  "sources": [
    "inferred from canon geography"
  ],
  "source_index": 35
}
