{
  "id": "material_pippali",
  "type": "material",
  "name": "Pippali",
  "classes": [
    "spice",
    "physic"
  ],
  "won_from": [
    "flora_long_pepper"
  ],
  "found_in": [
    "forest",
    "settlement"
  ],
  "rarity": "common",
  "notes": "Whole spikes picked unripe and dried grey. Hotter than round pepper and traded further.",
  "canon": "secondary",
  "sources": [
    "Indian ethnobotany, adapted to canon"
  ],
  "source_index": 60
}
