{
  "id": "material_wild_honey",
  "type": "material",
  "name": "Wild honey",
  "classes": [
    "produce",
    "physic"
  ],
  "won_from": [
    "fauna_golden_honey_goliath",
    "fauna_black_striped_siege_bee"
  ],
  "found_in": [
    "hills",
    "mountains"
  ],
  "rarity": "rare",
  "renews": "seasonal",
  "notes": "Cut from comb hung on the Narmada cliffs, where the honey-goliath and the siege bee both build and where the cave bear climbs for the same thing. Canon names it medicinal and rich in essential oil; it is also food. The Maru trade it to the asura-blooded for lanterns and saplings, and the upriver expedition logged the cliffside honey-gatherers' pacts without writing down their terms.",
  "canon": "inferred",
  "sources": [
    "database/fauna/fauna_golden_honey_goliath.json",
    "database/fauna/fauna_black_striped_siege_bee.json",
    "database/fauna/fauna_narmada_cave_bear.json",
    "database/cultures.json",
    "database/events/event_narmada_upriver_expedition.json"
  ],
  "source_index": 72
}
