{
  "id": "material_shed_snakeskin",
  "type": "material",
  "name": "Shed snakeskin",
  "classes": [
    "hide"
  ],
  "won_from": [
    "fauna_vasuki_indicus"
  ],
  "found_in": [
    "desert",
    "hills"
  ],
  "rarity": "common",
  "renews": "seasonal",
  "notes": "A whole shed, jaw to tail, dry as paper and patterned like water over stone. It takes an oiling to be worth anything and then it is the toughest light sheet anybody here has: it does not wet through and it does not crack.\n\nNothing is taken from a living animal. A serpent sheds when it grows, and the ground where it shed once is the ground it sheds on again -- so this is found by knowing where to look rather than won.",
  "canon": "primary",
  "sources": [
    "Varuna's Field Diary design"
  ],
  "source_index": 69
}
