{
  "id": "material_snow_moss",
  "type": "material",
  "name": "Snow moss",
  "classes": [
    "fibre"
  ],
  "won_from": [
    "flora_snow_looming_moss"
  ],
  "found_in": [
    "snow",
    "mountains"
  ],
  "rarity": "common",
  "renews": "slow",
  "notes": "Torn in dense mats off glacier-bound stone. The snow hares line their nests with it, and it does the same for a bedroll or a boot. Slow to come back, which is why a careful hand takes the edge of a mat and not the middle.",
  "canon": "inferred",
  "sources": [
    "database/flora/flora_snow_looming_moss.json"
  ],
  "source_index": 74
}
